Qno,URL,Title,Ques,Summary,Points,Ans,Source
22877,https://islamqa.info/en/answers/22877,What to Do When You Are Losing Faith in Islam,"I have been a religious person for several years, but for a few months I have been feeling that my mind and heart are devoid of faith and will power. This matter is tormenting me and I said to myself that perhaps this is a touch from the devil or something like that, and it will go away when Ramadan comes. But it has not gone away and I find it very difficult to pray Qiyam Al-Layl (night prayers).
I have tried to read more Quran despite these insinuating whispers and the distress it is causing me. My situation has started to affect me socially, at work, in the family and in my religion. 
Now I am living in torment because of this and I cannot find the faith which I feel has been taken away from me. I feel that I will have a bad end and that my faith will never return to me and that a seal has been placed over my heart. When I go to the mosque to pray, which I have not stopped doing, I feel that I am not like the other worshippers and I envy them for their faith. I also feel put off by religion and often I cannot listen to the Quran or Hadith (prophetic narrations), or listen to tapes, except with great difficulty. 
This is tormenting me because I do not want this, and I want to be like I was, a believer who loves the religion because it is the truth, but I feel that I cannot control my mind or my feelings. I have started to think about my sins which I believe are the cause of this, and I have started to remember many sins which I had forgotten, as if they are appearing before me one after the other.
Until now I am living with this torment, misery and distress. I do not know what has happened to me and what the solution and the remedy is. Will my faith come back to me or is this a bad end and a punishment from Allah? 
Finally, please do not forget to make Du`a (supplication) for me.","If you are losing faith in Islam, you need to increase your hope and trust in Allah. You should increase your good deeds, such as reading the Quran, giving charity, remembering Allah (Dhikr), upholding the ties of kinship, etc.",,"Praise be to Allah.My brother, have great hope in Allah, and do not let the devil cause you to despair of the vast mercy of Allah which He has guaranteed for His believing slaves. What you are telling yourself about this being a sign that you will die following something other than that which Allah wants is only insinuating whispers (Waswas ) from the devil and his deviant ideas by means of which he wants to tempt the slaves of Allah and lead them away from their religion. 
So he comes to a righteous slave and whispers to him that his good deeds are of no avail, or that he is doing them not for the sake of Allah but to show off to people, so that they will think he is good.
 All of these are the usual ways with which the devil tries to trick the slaves of Allah, especially those who show signs of being righteous – of whom I think that you are one, although I do not praise anyone before Allah – to hinder their efforts. We seek refuge with Allah from him. 
You need to increase your hope and trust in Allah Who forgives all sins, and who accepts the slave who seeks His protection and refuge, for He is the Most Merciful, the Oft-Forgiving and the Most Loving.  
You should increase your good deeds , such as reading the Quran, giving charity , remembering Allah (Dhikr ), upholding the ties of kinship, etc. 
The weakness which you feel also happens to others, for it is something natural. How many people were examples followed by others and had a great deal of drive and ambition, then they lost their drive and ambition for a long time, then it came back to them by the grace of Allah. 
Remember the words of the Prophet (peace and blessings of Allah be upon him): “Everybody has his time of energy, and every time of energy is followed by a time of lethargy. But if a person tries to follow a moderate path, then I have hope for him, but if he becomes one who is pointed out (in the street), then do not think anything of him.” (Narrated by At-Tirmidhi, 2453; classed as sound by Al-Albani in Sahih At-Tirmidhi, 1995) 
What is meant by “Everybody has his time of energy” is eagerness for a thing, energy and the desire to do good.
What is meant by “every time of energy is followed by a time of lethargy” is tiredness, weakness and lack of movement.
“But if a person tries to follow a moderate path” means that the one who has energy does his deeds in moderation and avoids going to extremes when he is feeling energetic and avoids being negligent when he is feeling lethargic.
“Then I have hope for him” means, I have hope that he will be successful, for he can continue following a middle course, and the most beloved deeds to Allah are those which are continuous.
“but if he becomes one who is pointed out (in the street)” means, if he strives hard and goes to extremes in doing good deeds so that he will become famous for his worship and asceticism, and he becomes famous and people point him out to one another,
“then do not think anything of him” means, do not think that he is one of the righteous, because he is showing off. He did not say, “do not have hope for him,” as an indication that he has already fallen, and he will not be able to make up for what he has missed out on. [Tuhfat Al-Ahwadhi] 
Think about this Hadith, and relate it to your own situation and the situation of others: you will see a clear similarity. This Hadith clearly states that man goes through a stage of incomparable eagerness and great focus and ambition, then suddenly he becomes weak and loses that focus and eagerness and ambition. When he reaches this stage, he must strive even harder to do obligatory duties and avoid prohibited things. If he does that, then there is the hope that he will succeed and progress, but if he falls into prohibited things and stops doing obligatory things, he will be lost and doomed.
So you must turn to Allah a great deal, seek His forgiveness and ask Him to make you steadfast until death. I also advise you to keep away from prohibited things. May Allah forgive your sins and make things easier for you.
For more details, please see the following answers: 9356 , 10776 , 14041 , and 223615 .
And Allah knows best.",Islam Q&A
22878,https://islamqa.info/en/answers/22878,Our attitude towards rumours and news on the Internet,"How should we deal with the rumours that appear on the Internet? What is the Muslim’s attitude towards the news that we read here and there, and what is written in chat rooms, especially since some of it is good news for the Muslims, but the source is unknown.",,,"Praise be to Allah.We live nowadays at a time when many rumours that bring hope are appearing in the guise of news. These appears on Internet web sites and chat rooms, so that they may be spread to the people as glad tidings and so that good-hearted people may accept them as indisputable facts coming from trustworthy sources. Even if any of them could be proven, there are still many rumours that can be classed as no more than fabrications. The one who thinks about this will understand that many of the global media, including the Arab media, exaggerate in their coverage of some events and they analyze them in a subjective manner that shows a complete bias and evident absence of objectivity, trying to take revenge by adding to the news and exaggerating, and telling weird news stories. So there is no such thing as credibility in these media, especially when emotions and wishes play a part. This is apart from the fact that media objectivity has become a victim of this current war, and western circles have rejected the lessons [of objectivity, etc.] that they used to teach others. But this does not mean that we should dispute the facts or deny what is taking place in reality, or that we should face this bias with exaggeration and hopes. 
Here we should pause and remind ourselves, and the good-hearted people who hear this news and tell it to others with good intentions – and those who fabricate these rumours and take upon themselves the job of propagating them – of a few facts.  
1 – We must be certain about the news we accept, and we should not accept it simply because it happens to coincide with our hopes and wishes. We have our own methodology of verifying matters, and we should be consistent with regard to what we like and dislike. It is not right for us to doubt news accompanied by pictures from the battlefield, or to shed doubts on it, when the bottom line is one’s senses. At a time when you see news going around through mobiles from some internet web sites, there are some people who may accept such news but it should be noted that there are people who will never believe it. So they should beware of exposing themselves to being called liars. An old proverb says, “Whoever pursues weird news will be disbelieved.” 
2 – We have to be cautious about the fact that the source is anonymous. There is no information more important than that of the Sunnah of the Prophet (peace and blessings of Allaah be upon him), yet despite that it is not part of the Muslims’ methodology to accept reports of the Sunnah from people who are unknown. Hence news must be taken from authentic sources; if it is not authentic then it should at least be known, so that people may be able to find out for themselves whether it is authentic or not. What a bad habit it is for a man to say, “I heard” or “they said.” 
3 – If there are people who permit the fabrication of rumours, basing that on some kind of ijtihaad, we must refuse to be the means of transmitting that by believing it and propagating it. (Whoever narrates a saying knowing it to be a lie is one of the liars). 
4 – One of the reasons used by the fabricators to justify making up these rumours is that it is a kind of lying in war, which is permissible. They ignore the fact – of which they are not ignorant – that the only kind of lying that is permitted in war is that which misleads the enemy, not that which creates illusions and deceives the Muslims. 
5 – If we have lost some aspects of the battle, we must not lose truthfulness which is our capital in our dealings with others. People will be astounded and amazed if they find out that this false news was transmitted through a good man. Whoever is known to have lied or to have transmitted lies will no longer be in a position to be considered trustworthy.
 6 – Similarly the righteous will be astounded and will become suspicious of a narrator who appeared to be righteous because he was telling this news and confirming it to them. At the same time, others will express joy, those who took the opposite stance to these youngsters and said, “This is their news, this is their credibility!” Everyone who was upset by the Muslim revival will find an opportunity to generalize this mistake and accuse all the pioneers of the revival of behaving like that. Please, for Allaah’s sake, do not make the enemy rejoice or give them a reason to attack. 
7 – If truthfulness is an Islamic virtue and part of Arabic chivalry, then telling lies is an obscenity that Islam has forbidden. Even the mushrik Arabs refrained from telling lies, as Abu Sufyaan – when he was still a mushrik – said: “Were it not that I am afraid that people may find out that I had told a lie, I would have told lies about him.” That was when he was speaking to Heraclius (about the Prophet (peace and blessings of Allaah be upon him)). He did not want to have even one lie to be found in his history, even if it was a lie told against his enemy Muhammad (peace and blessings of Allaah be upon him) to Heraclius (the Roman ruler). We are concerned that the propagation of these rumours may lead people to record a lot of lies against us. 
8 – Fabricating rumours and believing them readily is a form of escapism in the face of a reality which one dislikes and with which one does not feel comfortable.  
The soul finds consolation in denying that which it does not like and in fabricating and disseminating rumours, but in the end it will have to submit to the authority of overwhelming reality. But this psychological trick is not fit to be the means of escapism for the followers of Muhammad (peace and blessings of Allaah be upon him), who taught them the virtues of truthfulness and commanded them to strive their utmost to be truthful. He said: “Truthfulness leads to righteousness and righteousness leads to Paradise. A man will continue to speak the truth and strive to be truthful, until he will be recorded with Allaah as a speaker of the truth. And lying leads to immorality and immorality leads to Hell, a man will continue to tell lies and strive in telling lies, until he will be recorded with Allaah as a liar.” 
9 – Delaying recognition of realities and veiling reality with illusions, the greatest form of which is believing and disseminating rumours, will only multiply the amount of losses, and the greatest loss will be the loss of values. The highest and most precious of those values is truthfulness. “then if they had been true to Allaah, it would have been better for them” [Muhammad 47:21 – interpretation of the meaning]
 10 – Recognizing the truth is the first step towards dealing with crises and overcoming them, but not admitting them and concealing them are among the greatest means of reinforcing them, renewing them and repeating them.
 11 – Our advice is not to transmit this news. We must advise those who transmit it with the best of intentions and present them with the real facts, we should not try to spare their feelings at the expense of our reason and the transmission of truthful news, and we should try to rescue them from the anxiety of illusion and point them in the direction of reality, because truthfulness brings peace of mind and lies bring suspicion.
 12 – Sayyid Qutub (may Allaah have mercy on him) said: “The reality of a thing defeats the outward appearance of another thing, even if it is the reality of kufr.” 
How I wish that I did not have to talk in this manner, but the problem is there and must be addressed. I have tried to be truthful when speaking about truthfulness, for the dearest of speech to Allaah is that which is most sincere. 
“O you who believe! Be afraid of Allaah, and be with those who are true (in words and deeds)”
[al-Tawbah 9:119 – interpretation of the meaning]
O Allaah, show us the truth as truth and enable us to follow it; show us the false as false and enable us to avoid it. Guide us concerning disputed matters of truth by Your leave, for You guide Whomsoever You wish to the Straight Path. 
May Allaah send blessings and peace upon our Prophet Muhammd and upon his family and companions.",Shaykh ‘Abd al-Wahhaab ibn Naasir al-Tareeri
22880,https://islamqa.info/en/answers/22880,Is it permissible to wish for death for fear of losing one's faith,"I used to be a religiously committed girl who was seeking knowledge, but I drifted away from righteous friends without meaning to, then I started neglecting to seek knowledge because of weak faith, and my marriage was delayed so I started to watch foreign movies and the matter is getting worse. In the past I suffered from a psychological illness and I have nearly been cured, but my current situation makes me anxious and I relax by watching movies. I do not have the responsibility of a husband or children or studies; I have finished my studies and have no opportunity to work in the place where I live. To be honest I hope I will die soon; by Allaah, this is not in order to run away from the decree of Allaah, but because I am afraid that my negligence will increase and that when I die I will have wandered from the path that leads to Paradise. Please advise me, may Allaah bless you.",,,"Praise be to Allah.Although you have drifted away from righteous 
    friends without meaning to, but you could have avoided neglecting to seek knowledge and being careless in watching and listening to haraam things. 
    What happened to you after that may be because of the effect of those sins. We have mentioned some of those effects in our answer to question no.
    23425, which we hope you will look at. 
There are many women like you who have 
    delayed marriage, but they have not done what you did. Rather they make use of their time to memorize Qur’aan, seek knowledge and call people to 
    Allaah. This is the way in which Allaah opens hearts and puts minds at rest, and this is the way in which Allaah makes worldly matters easy for 
    those who follow it. 
Your wishing for death because you fear 
    becoming more careless and committing more sins is a great mistake. Rather you should only wish for death when you are in a better situation than 
    you are at present. It is up to you: you can take charge of yourself and go back to the way you were, and do better than that, in sha Allaah. But 
    you have to be honest with yourself and hasten to go back to the way that Allaah likes and is pleased with. 
Not everyone who wishes for death will get 
    what he wants; hence we are afraid that your situation may become even worse, which is what makes the Shaytaan happy and angers the Most Merciful. 
    You have to realize that. Your wish for death is not the solution to your problem. Rather the solution is to repent sincerely and to do that which 
    pleases Allaah, and to make up for what you have missed of actions that are pleasing to Allaah. 
Perhaps you know that what has happened to 
    you and what Allaah has decreed for you may be better for you, if you come back to Allaah, because you will regret what has happened and you will 
    do more acts of obedience and worship, and Allaah will turn the bad deeds that have been recorded against you into good deeds. This is the bounty 
    of Allaah towards His slaves. 
Shaykh al-Islam Ibn Taymiyah said: 
Whoever thinks that a person who has 
    committed sin and then repents will be lacking is making a great mistake, for the condemnation and punishment that may befall the sinner do not 
    affect the one who repents from sin at all. If he hastens to repent from sin then nothing will affect him, but if he delays repentance then he may 
    be affected by some condemnation and punishment during the period between committing sin and repenting. 
Majmoo’ al-Fataawa, 
    10/309. 
And he said: 
But a person may do something haraam and then repent, and that is good for him if he repents 
    from it, and by repenting he may become humble and soft-hearted, and more devoted to Allaah. Sins may serve an interest if one repents from them, 
    because if a person does not commit sin he may become arrogant, filled with self-admiration and hard-hearted, but if he commits sin, that humbles 
    him and softens his heart because of his repentance. 
Majmoo’ al-Fataawa, 
    14/474 
See also the answer to question no.
    21677, which describes how to treat anxiety and depression. 
And Allaah is the Guide to the straight path.",Islam Q&A
