Qno,URL,Title,Ques,Summary,Points,Ans,Source
27211,https://islamqa.info/en/answers/27211,Should he go back and live in a kaafir country?,"I have been advised by several muslims who are knowledgable in islam against living in a kaffir country (America). I am an American/Arab who has lived in America all my life but for a few months now was living in arabic country , however things are getting hard for me to continue living here (lack of income, housing etc) and am considering going back to America, also another strong reason is that the Health care system is better and free for my wife who is ill. Please give me as much a detailed answer from the hadith and quran as you can as I don't know for sure if I should strive to continue living here or go back to America regarding Islam.",,,"Praise be to Allah.The basic principle is that it is haraam to settle among the mushrikeen and in their land. If Allaah makes it easy for a person to move from such a country to a Muslim country, then he should not prefer that which is inferior [i.e., living in a non-Muslim country] to that which is better [living in a Muslim country] unless he has an excuse which permits him to go back. 
We advise you, as others have, not to go and live in a kaafir country, unless you are forced to go there temporarily, such as seeking medical treatment that is not readily available in a Muslim country.
Note that whoever gives up a thing for the sake of Allaah, Allaah will compensate him with something better, and that with hardship comes ease, and that whosoever fears Allaah and keeps his duty to Him, He will make a way for him to get out (from every difficulty), and He will provide him from (sources) he never could imagine. You should also note that preserving one’s capital is better than taking a risk in the hope of making a profit; the Muslim’s capital is his religion, and he should not risk it for the sake of some transient worldly gain. 
Shaykh Ibn ‘Uthaymeen (may Allaah have mercy on him) issued a detailed fatwa concerning the issue of settling in a kaafir country, which we will quote here. 
Shaykh Ibn ‘Uthaymeen said: 
Settling in a kaafir country poses a great danger to the Muslim’s religious commitment, morals, behaviour and etiquette. We and others have seen how many of those who settled there went astray and came back different from when they went; they have come back as evildoers, and some have come back having apostatized from their religion and disbelieving in it and in all other religions – we seek refuge with Allaah – denying it completely and mocking the religion and its people, past and present. Hence we must take measures to guard against that and stipulate conditions which will prevent people from following this path which leads to doom and destruction. 
There are two basic conditions which must be met before staying in kaafir countries: 
The first condition is: that the person must be secure in his religious commitment, so that he has enough knowledge, faith and will power to ensure that he will adhere firmly to his religion and beware of deviating or going astray, and that he has an attitude of enmity and hatred of the kaafirs and will not befriend them and love them, for befriending them and loving them are things that contradicts faith. Allaah says (interpretation of the meaning): 
“You (O Muhammad) will not find any people who believe in Allaah and the Last Day, making friendship with those who oppose Allaah and His Messenger (Muhammad), even though they were their fathers or their sons or their brothers or their kindred (people)”
[al-Mujaadilah 58:22]
And He says (interpretation of the meaning): 
“O you who believe! Take not the Jews and the Christians as Awliyaa’ (friends, protectors, helpers), they are but Awliyaa’ of each other. And if any amongst you takes them (as Awliyaa’), then surely, he is one of them. Verily, Allaah guides not those people who are the Zaalimoon (polytheists and wrongdoers and unjust).
And you see those in whose hearts there is a disease (of hypocrisy), they hurry to their friendship, saying: ‘We fear lest some misfortune of a disaster may befall us.’ Perhaps Allaah may bring a victory or a decision according to His Will. Then they will become regretful for what they have been keeping as a secret in themselves”
[al-Maa’idah 5:51, 52]
And it was narrated in al-Saheeh that the Prophet (peace and blessings of Allaah be upon him) said: “Whoever loves a people is one of them” and that “A man will be with the one whom he loves.” 
Loving the enemies of Allaah is one of the most serious dangers for the Muslim, because loving them implies that one agrees with them and follows them, or at the very least that one does not denounce them, hence the Prophet (peace and blessings of Allaah be upon him) said, “Whoever loves a people is one of them.” 
The second condition is that he should be able to practise his religion openly, so that he can observe the rituals of Islam with no impediment. So he will not be prevented from establishing regular prayer, and praying Jumu’ah and offering prayers in congregation if there are others there with whom he can pray in congregation and pray Jumu’ah; and he will not be prevented from paying zakaah, fasting, performing Hajj and doing other rituals of Islam. If he will not be able to do that then it is not permissible to stay there because it becomes obligatory to migrate (hijrah) in that case. 
Shaykh Ibn ‘Uthaymeen said – explaining the categories of people who settle in non-Muslim lands: 
The fourth category includes those who stay for an individual, permissible need, such as doing business or receiving medical treatment. It is permissible for them to stay as long as they need to. The scholars (may Allaah have mercy on them) have stated that it is permissible to go to kaafir countries in order to do business, and they narrated that some of the Sahaabah (may Allaah be pleased with them) had done that. 
The Shaykh said – at the end of the fatwa: 
How can the believer be content to live in the land of the kuffaar where the rituals of kufr are proclaimed openly and rule belongs to someone other than Allaah and His Messenger, seeing that with his own eyes, hearing that with his own ears and approving of it, and even starting to feel that he belongs there and living there with his wife and children, and feeling as comfortable there as he does in the Muslim lands, even though he and his wife and children are in such great danger and their religious commitment and morals are in such peril? 
Majmoo’ Fataawa al-Shaykh Ibn ‘Uthyameen, Fatwa no. 388. 
See also the answer to question no. 27211. 
And Allaah knows best.",Islam Q&A
27224,https://islamqa.info/en/answers/27224,Overnight stay of the Prophet (peace and blessings of Allaah be upon him) and Abu Bakr in the cave of Thawr,"I have been trying to find the hadeeth where it says that when the Prophet was migrating to Madeenah and he hid in the cave, an angel or angels covered with their wings the opening of the cave from the view of the searching party of the kuffaar.
The common version that is well known amongst Muslims is that a spider spun a web around the opening thus hiding the Prophet, but I found out that this narration is weak or fabricated, and that the report of angels covering the opening is an authentic version, can you tell me who the narrator was and in which book of hadeeth or seerah I can find this (with chains) ?.",,,"Praise be to Allah.The overnight stay of the Prophet (peace and blessings of Allaah be upon him) and Abu Bakr in the cave of Thawr is mentioned in the Book of Allaah and in the Sunnah of the Messenger of Allaah (peace and blessings of Allaah be upon him). There follow some details: 
1 – In the Book of Allaah: 
The story of this overnight stay is mentioned in the Qur’aan. Allaah says (interpretation of the meaning): 
“If you help him (Muhammad) not (it does not matter), for Allaah did indeed help him when the disbelievers drove him out, the second of the two; when they (Muhammad and Abu Bakr) were in the cave, he said to his companion (Abu Bakr): “Be not sad (or afraid), surely, Allaah is with us.” Then Allaah sent down His Sakeenah (calmness, tranquillity, peace) upon him, and strengthened him with forces (angels) which you saw not, and made the word of those who disbelieved the lowermost, while the Word of Allaah that became the uppermost; and Allaah is All-Mighty, All-Wise”
[al-Tawbah 9:40]
This verse clearly states that the mushrikeen were conspiring to kill him, and that they [i.e., the Prophet (peace and blessings of Allaah be upon him) and Abu Bakr] stayed overnight in the cave. 
2 – The Sunnah 
With regard to the reports in the saheeh Sunnah which speak of the overnight stay in the cave: 
-i- 
It was narrated that ‘Aa’ishah, the wife of the Prophet (peace and blessings of Allaah be upon him), said: “… then the Messenger of Allaah (peace and blessings of Allaah be upon him) and Abu Bakr headed towards a cave on the mountain of Thawr, and they hid in it for three nights, during which ‘Abd-Allaah ibn Abi Bakr – who was a smart young lad – stayed with them at night then left just before dawn (at the end of the night) so that he would be among Quraysh in Makkah when morning came, as if he had spent the night among them. He used to listen out to see what they were planning, then he would bring news of that [to the Prophet (peace and blessings of Allaah be upon him) and Abu Bakr] when darkness came…”                                                                
This was narrated by al-Bukhaari (3905) in a lengthy story to which he gave the title “The migration (hijrah) of the Prophet (peace and blessings of Allaah be upon him) and his companions to Madeenah.” 
-ii- 
It was narrated that Abu Bakr (may Allaah be pleased with him) said: I said to the Prophet (peace and blessings of Allaah be upon him), when I was with him in the cave: “If one of them looks down at his feet he will see us.” He said, “What do you think, O Abu Bakr, of two the third of whom is Allaah?” Narrated by al-Bukhaari, 3653. 
The story of the spider’s web was narrated by Imam Ahmad (3241) from Ibn ‘Abbaas (may Allaah be pleased with him), with regard to the verse (interpretation of the meaning): “And (remember) when the disbelievers plotted against you (O Muhammad) to imprison you” [al-Anfaal 8:30]. He said: Quraysh met together one night in Makkah. Some of them said: When morning comes, imprison him in chains – meaning the Prophet (peace and blessings of Allaah be upon him). Some said, No, kill him; and others said, No, drive him out. Allaah informed His Prophet (peace and blessings of Allaah be upon him) of that, so ‘Ali slept in the bed of the Prophet (peace and blessings of Allaah be upon him) that night, and the Prophet (peace and blessings of Allaah be upon him) went out and hid in the cave. The mushrikoon spent the night lying in wait for ‘Ali, thinking that he was the Prophet (peace and blessings of Allaah be upon him). When morning came, they pounced on him, and when they saw ‘Ali, Allaah thwarted their plot. They said, Where is that friend of yours? He said, I do not know. So they set out after him and when they reached the mountain, they were confounded. They climbed up the mountain and passed by the cave, and saw a spider’s web over its entrance. They said, If anyone had entered here, the spider would not have spun a web over the entrance. And he stayed there for three nights. 
The scholars differed concerning this hadeeth. Its isnaad was classed as hasan by al-Haafiz ibn Hajar in Fath al-Baari and by Ibn Katheer in al-Bidaayah wa’l-Nihaayah (3/222). It was classed as da’eef by al-Albaani in al-Silsilah al-Da’eefah. Ahmad Shaakir said in Tahqeeq al-Musnad (3251): there is some dispute concerning its isnaad. The commentators on al-Musnad said (3251): its isnaad is da’eef. And Allaah knows best. 
With regard to the story of the two doves or pigeons, this was mentioned by Ibn Katheer in al-Bidaayah wa’l-Nihaayah (3/223). He said, it was narrated by Ibn ‘Asaakir, then he said: This hadeeth is ghareeb jiddan with this isnaad. It was similarly classed as da’eef by the commentators on al-Musnad in the same place referred to above. 
Al-Albaani said in al-Silsilah al-Da’eefah (3/339): Note that there is no saheeh hadeeth concerning the spider and doves at the cave, despite the fact that this is widely mentioned in some books and lectures which are given on the anniversary of the migration of the Prophet (peace and blessings of Allaah be upon him) to Madeenah. So this should be borne in mind. 
With regard to the angels concealing the Prophet (peace and blessings of Allaah be upon him) and Abu Bakr, this was narrated by al-Tabaraani in al-Kabeer (24/106-108) from the hadeeth of Asma’ bint Abi Bakr. It is a lengthy hadeeth in which it says: “Then Abu Bakr said of a man whom he could see opposite the cave, ‘O Messenger of Allaah, he is looking at us.’ He said, ‘No, the angels are concealing us with their wings.’…” 
The isnaad of this hadeeth includes Ya’qoob ibn Humayd ibn Kaasib al-Madani, concerning whom the scholars differed. See Tahdheeb al-Kamaal by al-Mazzi, 32/318-323. 
He was regarded as da’eef (weak) by Ibn Ma’een, Abu Haatim, al-Nasaa’i and Abu Zar’ah al-Raazi. 
Abu Dawood al-Sijistaani said: we have seen in his Musnad ahaadeeth which we regard as munkar. We asked him for their sources and he refused to tell us, then he narrated them after that. We found ahaadeeth in some books that had been recently altered, and these ahaadeeth are mursal but he added isnaads to them and added something to the texts. 
Ibn ‘Adiyy said: There is nothing wrong with him and his reports. He narrated many ahaadeeth and many ghareeb reports. 
Al-Dhahabi said: He was one of the scholars of hadeeth but he reports munkar and ghareeb reports. 
Ibn Hibbaan classed him as thiqah (trustworthy). Al-Haafiz ibn Hajar said, he is sadooq (truthful) but he is confused sometimes. 
Al-Albaani (may Allaah have mercy on him) classed his hadeeth as hasan but he did not class this hadeeth as hasan. 
He said in al-Silsilah al-Da’eefah (3/263):
What is established concerning this Ya’qoob is that his hadeeth is hasan… If there is no other fault in the isnaad then it is hasan… Then he said: Shaykh al-Tabaraani Ahmad ibn ‘Amr al-Khallaal al-Makki did not find anything about his background. He narrated approximately 16 hadeeth from him in al-Mu’jam al-Awsat, which indicates that he was one of his well-known shaykhs. If the hadeeth is known or there are corroborating reports, then the hadeeth is hasan. 
And Allaah knows best.",Islam Q&A
27227,https://islamqa.info/en/answers/27227,He drank after the adhaan thinking that dawn had not yet come,"I was sleeping and I did not hear the adhaan of Fajr, and the alarm clock was running slow. After I had drunk a cup of water the iqaamah for prayer was given. What should I do? Please advise me, may Allah reward you.",,,"Praise be to Allah.The correct scholarly view is that whoever eats thinking that Fajr (dawn) has not yet come, then finds out that it had in fact come, does not have to do anything, because he was unaware of the time, so he is excused. 
Shaykh Ibn ‘Uthaymeen (may Allah have mercy on him) said: If a fasting person eats or drinks anything that breaks the fast out of ignorance, then his fast is still valid, whether he was unaware of the time, or unaware of the ruling, such as a man who gets up at the end of the night, and thinks that dawn has not yet come, so he eats and drinks, then he finds out that dawn had in fact come – his fast is still valid because he was unaware of the time. An example of one who is not aware of the ruling is a fasting person who has cupping done and does not know that cupping invalidates the fast, so we say to him: your fast is still valid. The evidence for that is the words of Allah (interpretation of the meaning): 
“Our Lord! Punish us not if we forget or fall into error, our Lord! Lay not on us a burden like that which You did lay on those before us (Jews and Christians); our Lord! Put not on us a burden greater than we have strength to bear. Pardon us and grant us forgiveness. Have mercy on us. You are our Mawlaa (Patron, Supporter and Protector) and give us victory over the disbelieving people” [al-Baqarah 2:286]
That is the evidence from the Qur’aan. The evidence from the Sunnah is the hadeeth of Asma’ bint Abi Bakr (may Allah be pleased with her) which was narrated by al-Bukhaari in his Saheeh. She said: “We broke our fast on a cloudy day at the time of the Messenger of Allah (peace and blessings of Allah be upon him), then the sun came out.” That meant that they had broken their fast during the day, but they did not realize, because they thought that the sun had set. But the Prophet (peace and blessings of Allah be upon him) did not tell them to make up that day; if it had been obligatory to make it up he would have told them to do so. And if he had told them to do that it would have been transmitted to us. 
Majmoo’ al-Fatawa, 19. 
See also question no.  38543.",Islam Q&A
27232,https://islamqa.info/en/answers/27232,Signs of Allah’s Love for His Slave,What are the signs of Allaah’s love for His slave?,,,"Praise be to Allah.You have asked about a serious and weighty matter, which none attain but very few of the righteous slaves of Allaah. 
The love of Allaah is ""the status for which the righteous compete and strive… It is the nourishment of hearts and souls… the delight of the eyes… It is the life of which one who is denied it is dead… the light which the one who loses it is in deep darkness… the healing of which the one who is denied is sick… the joy which the one who is deprived of it lives in distress and pain…  
It is the spirit of faith and good deeds… by means of which one may draw closer to Allaah… which, when it is absent, one is like a body in which there is no soul."" 
O Allaah, make us among those whom You love. 
The love of Allaah has signs and causes which are like the key to the door. These causes include the following: 
1 –Following the guidance of the Prophet (peace and blessings of Allaah be upon him). Allaah says in His Holy Book (interpretation of the meaning): 
""Say (O Muhammad to mankind): If you (really) love Allaah, then follow me (i.e. accept Islamic Monotheism, follow the Qur’aan and the Sunnah/prophetic teachings), Allaah will love you and forgive you your sins. And Allaah is Oft-Forgiving, Most Merciful""
[Aal ‘Imraan 3:31] 
2-5 – Being humble towards the believers and stern towards the kaafirsdisbelievers, waging jihad (a battle/struggle) for the sake of Allaah, and not fearing anyone or anything but Him. Allaah has mentioned these qualities in a single verse, in which He says (interpretation of the meaning): 
""O you who believe! Whoever from among you turns back from his religion (Islam), Allaah will bring a people whom He will love and they will love Him; humble towards the believers, stern towards the disbelievers, fighting/striving in the way of Allaah, and never fear of the blame of the blamers"" [al-Maa'idah 5:54] 
In this verse Allaah describes the attributes of those whom He loves, the first of which is: humility and not being arrogant towards the Muslims, and being stern towards the kaafirsdisbelievers, and not humbling or humiliating oneself before them. They (the ones whom Allaah loves) strive for the sake of Allaah, against the Shaytaan, the kuffaardisbelievers, the hypocrites and the evildoers, and they strive against their own selves (jihad al-nafs). They do not fear the blame of any blamer, because so long as they are following the commands of their religion, he will not care about anyone who mocks him or blames him. 
6 – Doing naafil (supererogatory) acts of worship.  Allaah says – according to a hadeeth qudsi (divinely inspired saying of the Prophet) – ""My slave keeps drawing near to me by means of supererogatory acts of worship until I love Him."" Supererogatory acts of worship include naafil prayers, charity, ‘Umrah, Hajj (minor and major pilgrimage to Makkah) and fasting. 
8-12 – Loving, visiting one another, helping one another (financially) and offering sincere advice to one another for the sake of Allaah. 
These attributes were mentioned in a single hadeeth (narration) in which the Messenger (peace and blessings of Allaah be upon him) narrated that his Lord said: ""My love is guaranteed for two who love one another for My sake; My love is guaranteed for two who visit one another for My sake; My love is guaranteed for two who help one another (financially) for My sake; My love is guaranteed to for two who uphold ties with one another for My sake."" 
Narrated by Ahmad, and 4/236 and 5/236; al-Tanaasuh by Ibn Hibbaan, 3/338; the two ahaadeeth were classed as saheeh by Shaykh al-Albaani in Saheeh al-Targheeb wa’l-Tarheeb, 3019, 3020, 3021. 
What is meant by ""two who visit one another for My sake"" is that they only visit one another for the sake of Allaah, seeking thereby His pleasure for their loving one another for His sake or cooperating in worshipping Him. 
From al-Muntaqa Sharh al-Muwatta’, hadeeth 1779. 
13 – Being tested. Calamities and disasters are a test for a person, and this is a sign that Allaah loves him, because this is like medicine: even though it is bitter, but still you offer the medicine, despite its bitterness, to the one whom you love; and Allaah’s is the highest description. According to a saheeh hadeeth (authentic narration): ""The greatest reward comes from the greatest trial. When Allaah loves people, He tests them, and whoever accepts it gains the pleasure of Allaah and whoever complains earns His wrath. 
Narrated by al-Tirmidhi, 2396;and Ibn Maajah, 4031; classed as saheeh by Shaykh al-Albaani. 
For calamities to befall the believer is better than punishments being stored up for him in the Hereafter. How can it be otherwise when he is raised in status and his bad deeds are erased thereby? The Prophet (peace and blessings of Allaah be upon him) said: ""When Allaah wills good for His slave, He hastens his punishment in this world, and when He wills bad for His slave, He withholds his sins until he comes with them on the Day of Resurrection.""  
Narrated by al-Tirmidhi, 2396; classed as saheeh by al-Albaani. 
The scholars have explained that the one from whom calamities and trials are withheld is the hypocrite, for Allaah withholds [his punishment] in this world, so as to bring him with all his sins on the Day of Resurrection. 
O Allaah, make us among those whom You love. 
If Allaah loves you, do not ask about the good that you will attain and the virtue that you will acquire… it is sufficient for you to know that you are the beloved of Allaah. The great fruits of the love of Allaah for His slave are as follows: 
1 – People will love him and he will be accepted on earth, as it says in the hadeeth narrated by al-Bukhaari (3209): ""When Allaah loves a slave, He says to Jibreel, 'I love so-and-so, so love him,' so Jibreel loves him and then calls out to the people of heaven, 'Allaah loves so-and-so, so love him,' and the people of heaven love him, and then acceptance is placed in the Earth for him."" 
2 – What Allaah has mentioned in the hadeeth qudsi of the great virtues of those whom He loves. It was narrated that Abu Hurayrah said: The Messenger of Allaah (peace and blessings of Allaah be upon him) said: ""Whosoever shows enmity to someone devoted to Me, I shall be at war with him. My servant draws not near to Me with anything more loved by Me than the religious duties I have enjoined upon him, and My servant continues to draw near to Me with supererogatory works so that I shall love him. When I love him I am his hearing with which he hears, his seeing with which he sees, his hand with which he strikes and his foot with which he walks. Were he to ask [something] of Me, I would surely give it to him, and were he to ask Me for refuge, I would surely grant him it. I do not hesitate about anything as much as I hesitate about [seizing] the soul of My faithful servant: he hates death and I hate hurting him."" Narrated by al-Bukhaari, 6502. 
This hadeeth qudsi includes a number of benefits of Allaah’s love for His slave: 
(i)                ""I am his hearing with which he hears"" i.e., he does not listen to anything but that which Allaah loves.
(ii)              ""his seeing with which he sees"" i.e., he does not see anything but that which Allaah loves.
(iii)            ""his hand with which he strikes"" i.e., he does not do anything with his hand but that which Allaah loves.
(iv)            ""and his foot with which he walks"" i.e., he does not go towards anything but that which Allaah loves.
(v)              ""Were he to ask [something] of Me, I would surely give it to him"" i.e., his du’aa’s (supplications) are heard and his requests are granted.
(vi)            ""and were he to ask Me for refuge, I would surely grant him it"" i.e., he is protected by Allaah from all things… 
We ask Allaah to help us to please Him. 
And Allaah knows best.",Islam Q&A
