Qno,URL,Title,Ques,Summary,Points,Ans,Source
22860,https://islamqa.info/en/answers/22860,Dealing With New Situations,"Sometimes the Muslim is faced with a situation concerning which he does not know what position he should take, whether those matters are political, da’wah-related (religious), social or even personal. How can I find out the correct way of dealing with a situation with which I am faced?",,,"Praise be to Allah.
    I thank you for your question and ask Allaah to grant us and 
    you strength, steadfastness and wisdom, and to show us what is true and help 
    us to follow it, and to show us what is false and help us to avoid it, and 
    not to let it confuse us and lead us astray… With regard to what you asked 
    about, my comments on it are as follows: 

    You should note that we are not obliged to define our stance 
    or opinion on every issue or event that occurs, simply because much of what 
    occurs does not concern us. With regard to the things that do concern us and 
    on which we should form opinions, they are of different types: 

    1 – Matters which because of their depth and breadth go 
    beyond the limits of our knowledge and understanding. Concerning these 
    matters we must consult the opinions of specialists, scholars, researchers 
    or experts, as much as possible. 

    2 – Matters which are so clear that they have become the talk 
    of gatherings and the media. We can form an opinion on such matters by 
    reconciling between the views of those whom we trust and some of the 
    reports. 

    3 – Matters within our own private circle. These require us 
    to look at all the alternatives and weigh up the pros and cons of each, then 
    compare them objectively. This will enable us to form an initial idea, then 
    we can consult others and seek the opinions of people who have prior 
    experience in this field, or those whose opinions we trust. Whoever consults 
    people will benefit from their experience and knowledge. As time goes by and 
    we make mistakes and benefit from our experience, we will accumulate 
    experience and more understanding, and will develop the ability to evaluate 
    things. In the light of this experience we will be able to form our own 
    opinions. 

     May Allaah help you and protect you, and make you steadfast 
    in adhering to the path of truth and goodness.",Ahmad al-Muqbil : (islam Today)
22862,https://islamqa.info/en/answers/22862,Can One Accept Prizes Given by Stores in Islam?,"Every so often a group of stores or newspapers etc., run competitions offering prizes in order to attract a greater number of customers. I hope that you can explain to me the ruling on taking part in these competitions, quoting whatever you can from the fatwas of well-known scholars on this subject so that I can have a good idea. May Allah reward you with good.","Contemporary scholars differ with regard to offering prizes in order to attract customers and there are two views, one of which is that it is not allowed at all, and the other is that it may be permissible, so long as certain conditions are met.",,"Praise be to Allah.Offering prizes in order to attract a greater number of customers is a modern issue in marketing due to the competition that exists in the marketplace and the keenness of sellers to promote their products. Contemporary scholars differ with regard to this issue and there are two views, one of which is that it is not allowed at all, and the other is that it may be permissible, so long as certain conditions are met. 
Among those who are of the view that it is not allowed and is prohibited are the scholars of the Standing Committee for Issuing Fatwas and Shaykh Ibn Baz (may Allah have mercy on him). There follow some of their Fatwas: 
The Standing Committee for Issuing Fatwas was asked: There are some food stores in America that, when you buy from them, give you some numbers. When you have collected a certain amount of numbers as stipulated by the store, you get a prize, namely a sum of money. Is it permissible for a Muslim to take this prize, knowing that he has not paid anything for it, and it is simply because he has bought from the store or has visited the store that he has been given these numbers through which he won that prize. 
They replied: 
“If the matter is as described, it is not permissible for you to take this prize which is given by the store because of your buying from them or because you visited them. Your choosing these numbers which were unknown to you at the time when you chose them and became known only after you chose them is a kind of gambling, and it is known that gambling is prohibited according to the Quran and Sunnah and the consensus of the scholars.”  (Fatwa no. 5847. ""(Fatawa Al-Lajnah Ad-Da`imah, 15/191)
 The Standing Committee was also asked: There are some merchants who sell a certain item for one hundred Riyals, which is sold by other for approximately twenty Riyals, with a chance to win a prize of a car or some other prize, and the people rush to buy from them because they want to win that prize. Is this permissible? Please advise us, may Allah reward you with good. 
They replied: 
“What you have asked about is not permissible, rather it is an evil action and a kind of gambling which Allah has forbidden because it involves risks and deceit, and consuming people’s wealth unlawfully. Allah says (interpretation of the meaning):
 “O you who believe! Intoxicants, and gambling, and Al-Ansab (slaughtering for idols), and Al-Azlam (drawing lots seeking luck or to make a decision) are an abomination of Satan’s handiwork. So avoid (strictly all) that (abomination) in order that you may be successful.
91. Satan wants only to excite enmity and hatred between you with intoxicants and gambling, and hinder you from the remembrance of Allah and from As-Salah (the prayer). So, will you not then abstain?” [Al-Ma'idah 5:90-95] 
“O you who believe! Eat not up your property among yourselves unjustly” [An-Nisa’ 4:29]
It was narrated in an authentic Hadith that the Prophet (peace and blessings of Allah be upon him) forbade deceitful and ambiguous sales. May Allah help you to do all that is good and make things easy for you.” (Fatwa no. 18324.""(Fatawa Al-Lajnah, 15/195) 
The Committee was also asked: What is the ruling on prizes that are offered by some phone companies to entice callers to call more than once? 
They replied: 
“The prizes that are given to callers using the public phones in centres are not permissible because that involves gambling and deceiving the people and consuming their wealth unlawfully in order to promote use of the telephones and increase the company’s earnings from them, as well as the enmity that it stirs up among the owners of the centres themselves and the callers. Allah says (interpretation of the meaning):
 “O you who believe! Intoxicants, and gambling, and Al-Ansab (slaughtering for idols), and Al-Azlam (drawing lots seeking luck or to make a decision) are an abomination of Satan’s handiwork. So avoid (strictly all) that (abomination) in order that you may be successful.
91. Satan wants only to excite enmity and hatred between you with intoxicants and gambling, and hinder you from the remembrance of Allah and from As-Salah (the prayer). So, will you not then abstain?” [Al-Ma'idah 5:90-95] (Fatwa no. 19560, Fatawa Al-Lajnah Ad-Da’imah, 15/196)
Shaykh Ibn Baz (may Allah have mercy on him) was asked the following question: In our city there is a co-operative association which displays cars in front of their entrance; whoever buys something from them for one hundred Dirhams or more is given a free ticket on which is printed “worth ten Dirhams.” After that a draw is made in which the lucky person – as they say – is given the car that was on display. My question is: 
1 – What is the ruling on taking part in this draw with this ticket that is given for free, and the participant does not lose anything if he does not win? 
2 – What is the ruling on buying from that co-op with the intention of getting the ticket mentioned so that one can take part in the competition? The people here, even the educated ones, are confused about this matter. I hope that you can answer these two questions with whatever evidence is available so that the Muslims may understand this matter better on the basis of religious teaching. May Allah reward you with good. 
He (may Allah have mercy on him) replied as follows: 
“This competition is regarded as a form of gambling, which Allah has forbidden as He says (interpretation of the meaning):
 “O you who believe! Intoxicants, and gambling, and Al-Ansab (slaughtering for idols), and Al-Azlam (drawing lots seeking luck or to make a decision) are an abomination of Satan’s handiwork. So avoid (strictly all) that (abomination) in order that you may be successful.
91. Satan wants only to excite enmity and hatred between you with intoxicants and gambling, and hinder you from the remembrance of Allah and from As-Salah (the prayer). So, will you not then abstain?” [Al-Ma'idah 5:90-95]
The authorities and scholars in Fujayrah and elsewhere should denounce these competitions and warn against them, because that goes against the Book of Allah and is also consuming the people’s wealth unlawfully. May Allah bless us all with guidance and adherence to the truth.” (Majallat Ad-Da’wah, issue no. 1145, dated 29/10/1408 AH) 
Shaykh Ibn ‘Uthaymin (may Allah have mercy on him) discussed in detail the ruling on taking part in these competitions. He said that it is permissible so long as two conditions are met. He said:  
Companies nowadays offer prizes to those who buy from them. We say that there is nothing wrong with these so long as two conditions are met: 

The price – of the goods purchased – should be their true price, i.e., the price should not be raised because of the prize. If the price is raised because of the prize then this is gambling and is not permissible. 
The customer should not buy the product in order to win the prize. If he buys it only because he wants to win the prize, and he has no need for the product, then this is a waste of money. We have heard that some people buy a carton of milk or yoghurt which they do not need, but they hope that they will win a prize, so you see them buying it then throwing it away in the market or outside the house. This is not permissible, because it is a waste of money, and the Prophet (peace and blessings of Allah be upon him) forbade wasting money.” ( As’ilat Al-Bab Al-Maftuh, no. 1162) 

This view is more correct – in sha Allah – so long as a person is certain that he is fulfilling the second condition, because he is the only one who knows what he feels in his heart; no other human being can know that.
We ask Allah to grant us provision that is good and permissible, and to bless us with conviction and contentment, and to keep us away from that which is haram and that which leads to it. 
And Allah knows best.",Sheikh Muhammed Salih Al-Munajjid
22866,https://islamqa.info/en/answers/22866,Eating peacock meat,Is it permissible to eat peacock meat if slaughtered in the halaal method?.,,,"Praise be to Allah.It is permissible to eat peacock meat because the basic principle is that it is halaal. Allaah says (interpretation of the meaning): 
“He it is Who created for you all that is on earth”
[al-Baqarah 2:29]
And it does not come under the same heading as the things prohibited in the hadeeth: The Prophet (peace and blessings of Allaah be upon him) forbade the eating of every animal that has fangs and every bird that has talons. Narrated by Muslim, 3574. And it is not harmful, so it is permissible to eat it. And Allaah knows best.",Shaykh Dr Khaalid al-Mushayqih
22869,https://islamqa.info/en/answers/22869,It is not permissible to sell gold for money unless the full price is paid in the same sitting,"I have a jewellery store and some of my relatives or friends come to me to buy gold, and they ask me to let them take the gold and they will give me the money a day or two after that. I am afraid that if I tell them that this is haraam, this will lead to breaking of the ties of kinship.",,,"Praise be to Allah.It is not permissible to sell gold for money unless the gold and the money are handed over in the same sitting. This is what has been stated by the fuqaha’. This is called taqaabud (a reciprocal taking possession of commodity and its monetary equivalent by buyer and seller respectively), in which the buyer takes the gold, and the seller takes the money (in the same sitting). It is not permissible to sell gold if there is no taqaabud. See question no. 65919 . 
What you have to do is to explain this to those who buy from you, and what a Muslim has to do is to listen and obey whatever Allaah and His Messenger (peace and blessings of Allaah be upon him) have commanded. You are not doing this because you do not trust them, for example, rather you are doing it in order to follow the sharee’ah. You should explain this in a kind and gentle manner. 
Shaykh Muhammad ibn Saalih ibn ‘Uthaymeen (may Allaah have mercy on him) was asked: 
What is the ruling on giving gold before receiving the money for it, if it is given to a relative because of the fear of severing the ties of kinship and I am aware that he will pay for it even if that is after some time? 
He replied: 
You should be aware of the general principle that it is not permissible to sell gold for money at all unless the price is paid in full immediately. It makes no difference if the customer is a relative or a stranger, because the religion of Allaah does not favour one at the expense of the other. If your relative gets angry with you for obeying Allaah, then let him get angry, for he is the wrongdoer and sinner who wants you to disobey Allaah, and in fact you have honoured him by preventing him from entering into a kind of transaction with you that is haraam. If he gets angry or cuts off ties with you for this reason, then he is the sinner and there is no sin on you. 
Fiqh wa Fatwa al-Buyoo’, compiled by Ashraf ‘Abd al-Maqsood, p. 389.",Islam Q&A
22870,https://islamqa.info/en/answers/22870,Is rent received from a bank halaal?,We rent our complex for a bank...whether the rent which we receive from the bank is halal. please clarify.,,,"Praise be to Allah.Firstly: 
Dealing in riba is haraam and is a major sin. Allaah says (interpretation of the meaning): 
“O you who believe! Fear Allaah and give up what remains (due to you) from Ribaa (from now onward) if you are (really) believers.
279. And if you do not do it, then take a notice of war from Allaah and His Messenger but if you repent, you shall have your capital sums. Deal not unjustly (by asking more than your capital sums), and you shall not be dealt with unjustly (by receiving less than your capital sums)” [al-Baqarah 2:278-278]
Secondly: 
Once it is established that it is haraam to deal in riba, then it is also haraam to help others in that in any way whatsoever. That is because Allaah says (interpretation of the meaning): 
“Help you one another in Al‑Birr and At‑Taqwa (virtue, righteousness and piety); but do not help one another in sin and transgression” [al-Maa’idah 5:2]
Based on this, it is not permissible for you to rent a place to a bank that deals in riba, because that is helping the bank in this major sin, namely riba. It was proven that the Prophet (peace and blessings of Allaah be upon him) cursed the one who consumes riba, the one who pays it, the one who writes it down and the two who witness it, and he said: “They are all the same.” Narrated by Muslim, 1598. 
Al-Nawawi said: This indicates that it is haraam to cooperate in falsehood. 
Al-Sindi said: All of them are cursed for their participation in sin. 
The scholars of the Standing Committee for Issuing Fatwas were asked: 
I own a building and one of the banks applied to rent it. This bank is one of those that deal in riba. Is it permissible for me to rent it to this bank and others that deal in riba, or not? 
They replied: 
That is not permissible, because the bank mentioned is going to use it as a place for dealing in riba, which is haraam. Renting it to them for this purpose is helping them in doing something haraam. Allaah says (interpretation of the meaning): 
“Help you one another in Al‑Birr and At‑Taqwa (virtue, righteousness and piety); but do not help one another in sin and transgression” [al-Maa’idah 5:2]
Fataawa Islamiyyah, 2/423, 424 
Shaykh ‘Abd al-‘Azeez ibn Baaz said: 
There are many verses and ahaadeeth which indicate that it is haraam to cooperate in sin. By the same token it is haraam to rent property to owners of banks that deal in riba, because of the evidence mentioned. Fataawa Islamiyyah, 2/395 
The rent that you take from the bank is haraam wealth, which you must get rid of by giving it in charity. You must hasten to do that, because the Prophet (peace and blessings of Allaah be upon him) said: “Every body that is nourished on haraam things, the Fire is more fitting for it.” Narrated by al-Tabaraani; classed as saheeh by al-Albaani in Saheeh al-Jaami’, 4519. 
With regard to the rent that you took before you knew that it is haraam, it is permissible for you, because Allaah said, when He revealed the prohibition of riba (interpretation of the meaning): 
“So whosoever receives an admonition from his Lord and stops eating Ribaa, shall not be punished for the past; his case is for Allaah (to judge)” [al-Baqarah 2:275]
See also questions no. 2492 and 8196 
And Allaah knows best.",Islam Q&A
22871,https://islamqa.info/en/answers/22871,Meaning of the aayah “His is the highest description”,"Allaah says (interpretation of the meaning): “His is the highest description (i.e. none has the right to be worshipped but He, and there is nothing comparable unto Him) in the heavens and in the earth” [al-Room 30:27] Does mathal [translated here as “description”] mean likeness?",,,"Praise be to Allah.and blessings and peace be upon the Messenger of Allaah.
The phrase “al-mathal al-‘alaa (translated here as ‘the highest description’)” means the highest description in all aspects. For Allaah has the attribute of absolute perfection in all senses, as He says (interpretation of the meaning):
“There is nothing like Him, and He is the All-Hearer, the All-Seer”
[al-Shoora 42:11] 
“Say (O Muhammad): He is Allaah, (the) One.
Allaah-us-Samad [Allaah — the Self-Sufficient Master, Whom all creatures need, (He neither eats nor drinks)].
He begets not, nor was He begotten.
And there is none co-equal or comparable unto Him.”
[al-Ikhlaas 112:1-4]
And Allaah is the Source of strength.","Majmoo’ Fataawa wa Maqaalaat Samaahat al-Shaykh Ibn Baaz (may Allaah have mercy on him), 6/221"
22872,https://islamqa.info/en/answers/22872,Is it prescribed to boycott innovators in this day and age?,When is it prescribed to boycott innovators (followers of bid’ah)? When is it prescribed to hate for the sake of Allaah? Is it prescribed to boycott them in this day and age?,,,"Praise be to Allah.
    The believer should analyze the situation in the light of 
    faith and sharee’ah, and ignore his whims and desires. If his shunning and 
    keeping away from the innovator will not result in a greater evil, then it 
    is prescribed, and at the very least it is Sunnah. Similarly, shunning those 
    who openly commit sin is at the very least Sunnah. But if not shunning them 
    will be more effective because one thinks that calling these innovators, 
    guiding them to the Sunnah and teaching them what Allaah has enjoined upon 
    them will be more effective in guiding them, then he should not hasten to 
    shun them, but he should hate them for the sake of Allaah just as he hates 
    the kaafirs and sinners. But his hatred for the kuffaar should be greater, 
    whilst also calling them to Allaah and striving to guide them, acting in 
    accordance with all the shar’i evidence. So he should hate the innovator in 
    accordance with the degree of his innovation, so long as it does not imply 
    kufr, and he should hate the sinner in accordance with the degree of his 
    sin, but he should also love him for the sake of Allaah in accordance with 
    the degree of his Islam and faith. From this we know that shunning depends 
    on the situation. 

    Conclusion: the most correct approach is to look at the 
    shar’i interests involved, because the Prophet  (peace and blessings of 
    Allaah be upon him) shunned some people and not others, depending on the 
    objectives of Islam. He shunned Ka’b ibn Maalik and his two companions (may 
    Allaah be pleased with them) when they stayed behind from the campaign of 
    Tabook with no excuse. He shunned them for fifty days, until they repented 
    and Allaah accepted their repentance. But he did not shun ‘Abd-Allaah ibn 
    Ubayy ibn Salool and a group of those who were accused of hypocrisy, for 
    shar’i reasons. 

    The believer looks at what is in the best interests (of 
    Islam). This does not contradict the idea of hating the kaafirs, innovators 
    and sinners for the sake of Allaah and loving the Muslims for the sake of 
    Allaah. Attention must be paid to what is in the general interest; if 
    shunning is better then they should be shunned, but if the objectives of 
    Islam dictate that ongoing da’wah efforts should be made rather than 
    shunning, then that is what should be done, following the teaching of the 
    Prophet  (peace and blessings of Allaah be upon him). And Allaah is the 
    Source of strength.","Majmoo’ Fataawa wa Maqaalaat Mutanawwi’ah li Samaahat al-Shaykh Ibn Baaz (may Allaah have mercy on him), 9/423"
