Qno,URL,Title,Ques,Summary,Points,Ans,Source
12867,https://islamqa.info/en/answers/12867,Ruling on saying “you don’t deserve this” to one who is sick,"Sometimes when people visit a person who is sick, they say to him, “you don’t deserve this”. Or when they hear that a certain person is sick, they say, “By Allaah, he doesn’t deserve that. We hope that you can tell us whether it is permissible to say this or not?",,,"Praise be to Allah.It is not permissible to
      say this, because it is like objecting to Allaah, may He be exalted. He
      knows best about the situation of His slaves, and He is Most Wise in what
      He decrees for them of health and sickness, richness and poverty, and so
      on. 
What is prescribed is to
      say, “May Allaah grant him good health and heal him,” and similar good
      phrases. 
May Allaah help all the
      Muslims to understand their religion and adhere to it steadfastly, for He
      is the Best to be asked.","Majmoo’ Fataawaa wa Maqaalaat Mutanawwi’ah li Samaahat al-Shaykh al-‘Allaamah ‘Abd al-‘Azeez ibn ‘Abd-Allaah ibn Baaz (may Allaah have mercy on him), vol. 8, p. 421"
12871,https://islamqa.info/en/answers/12871,Is It Prohibited to Point Feet towards the Qiblah?,Some people say that you are not allowed to point your feet at the Qiblah while sitting down in the mosque and that it is bad manners. Does this have any basis or is it a cultural thing or is an addition?,"There is nothing to say that pointing one’s feet in the direction of the Qiblah is not allowed, but some of the scholars regarded it as disliked to stretch the feet out towards the Ka`bah if one is close to it.",,"Praise be to Allah.Shaykh `Abdullah ibn Humayd (may Allah have mercy on him) was asked about pointing one’s feet in the direction of the Qiblah. 
He replied: 
“There is nothing to say that pointing one’s feet in the direction of the Qiblah is not allowed, but some of the scholars regarded it as disliked to stretch the feet out towards the Ka`bah if one is close to it; they regarded this as disliked but not emphatically so. But if there is a mosque somewhere else and there is a Muslim there who points his feet towards the Qiblah, there is no harm in that and he is not doing anything forbidden in sha Allah, as the scholars stated. And Allah knows best.” (Fatawa Ash-Shaykh Ibn Humayd, p. 144) 
Shaykh Ibn `Uthaymin (may Allah have mercy on him) was asked about pointing the feet towards the Qiblah whilst sleeping. He said: 
“There is no blame on a person if he sleeps and his feet are pointing towards the Qiblah .” (Fatawa Ash-Shaykh Ibn `Uthaymin, 2/976)
For more details, please refer to the following answers: 66200 , and 69808 .
And Allah knows best.",Sheikh Muhammed Salih Al-Munajjid
12874,https://islamqa.info/en/answers/12874,Ruling on studying man-made laws,"What is the ruling on studying man-made laws, and teaching them?.",,,"Praise be to Allah.There is no doubt that Allah has enjoined upon His slaves to rule according to His sharee’ah and to refer to it for judgement, and He has warned against ruling by any other laws and has stated that this is the characteristic of the hypocrites. He has also stated that any rule other than His rule is the rule of Jaahiliyyah (ignorance) and that there is nothing better than His rule. Allah tells us that people do not truly believe until they refer to His Messenger (peace and blessings of Allah be upon him) for judgement in all disputes between them, and find in themselves no resistance against his decisions, and accept (them) with full submission. In Soorat al-Maa'idah Allah tells us that ruling by anything other than that which He has revealed is kufr (disbelief), wrongdoing and evildoing. All these things that we have mentioned here are clearly stated by Allah in His Book.
 With regard to those who study and teach man-made laws, they fall into different categories: 
-1-
Those who study it or teach it in order to understand its real nature, or to understand the superiority of sharee’ah to these laws, or to benefit from it in ways that do not go against sharee’ah, or to benefit others in such ways. It seems that there is no sin on the one who does this, indeed he may be rewarded for that if he seeks to expose its faults and demonstrate the superiority of sharee’ah. The ruling on people in this category is the same as the ruling on those who study the rulings on riba and the various kinds of alcohol and gambling, and false beliefs, or who teach about such matters so that he may know them and the Islamic rulings on them, or he may inform others of that, whilst also believing that they are haraam, just as those in this category who study law believe that man-made laws which go against the laws of Allah are haraam. They do not come under the same ruling as those who learn or teach witchcraft and the like, because witchcraft is haraam in and of itself, as it involves shirk and worship of the jinn instead of Allah. So the one who learns it or teaches it to others only attains it by means of shirk, unlike the one who studies law or teaches it to others, not because he thinks that it is permissible, but for a permissible or Islamically prescribed purpose, as stated above. 
-2-
Those who study law or teach it to others in order to pass judgements thereby or to help others to do so, even though they believe that it is haraam to rule by anything other than that which Allah has revealed. But their desires or love of money makes them do that. These people are undoubtedly doing wrong and they are committing kufr, wrongdoing and evil, but it is minor kufr, minor wrongdoing and minor evil that does not put them beyond the pale of Islam. This view is well known among the scholars. It is also the view of Ibn ‘Abbaas, Tawoos, ‘Ata’, Mujaahid and a number of the earlier and later generations, as was stated by al-Haafiz ibn Katheer, al-Baghawi, al-Qurtubi and others. The great scholar Ibn al-Qayyim (may Allah have mercy on him) also mentioned something similar in his book Kitaab al-Salaah. Shaykh ‘Abd al-Lateef ibn ‘Abd al-Rahmaan ibn Hasan (may Allah have mercy on him) wrote an excellent essay on this topic which has been published in the third volume of al-Rasaa’il al-Oola. 
Those who learn and teach man-made systems of law are likened to those who learn about different kinds of riba, alcohol and gambling and teach them to others for some whims and desires of their own or because of their greed for money, even though they do not regard that as permissible. They know that all dealings involving riba are haraam, just as they know that drinking intoxicants and gambling are haraam, but because they are weak in faith and are overwhelmed by whims and desires or greed for money, their belief that these things are haraam does not stop them from dealing in these forbidden things. According to the belief of Ahl al-Sunnah, they are not regarded as kaafirs because of their dealing in those things, so long as they do not believe that that is permissible.
 -3-
Whoever studies or teaches manmade laws and believes that ruling by them is permissible, whether he believes that sharee’ah is superior to them or not, is a kaafir in the sense of major kufr, according to the consensus of the Muslims, because by believing that it is permissible to rule by man-made laws that go against sharee’ah he is regarding as permissible something that no Muslim has any excuse for not knowing that it is haraam. So he comes under the same ruling as one who regards adultery or alcohol etc as permissible, and because by believing these laws to be permissible he is disbelieving in Allah and His Messenger and rejecting the Quran and Sunnah. The scholars of Islam are unanimously agreed that the one who regards as permissible something that Allah has forbidden, or regards as forbidden something that Allah has permitted, which is well known in Islam and no Muslim has any excuse for not knowing it, is a kaafir. Whoever studies the words of the scholars of all four madhhabs on the rulings on apostates will understand what we have said clearly.","Majmoo’Fataawa al-Shaykh Ibn Baaz, 2/325-331"
12897,https://islamqa.info/en/answers/12897,She is asking about a specific du’aa’ for when she finishes her period,"There is a similar question on this site, but it is not exactly what I need.  I was wondering if, when a lady needs to purify herself from the menses, how should she, and is there a special dua she needs to make?",,,"Praise be to Allah. 
          If the bleeding stops and she become pure, and she does 
          ghusl after menstruation with the intention of purifying herself, then 
          she is considered to be pure (taahirah). There is no specific du’aa’ 
          for that, apart from the well known du’aa’s that have been narrated 
          for doing wudoo’. And Allaah knows  best.",Sheikh Muhammed Salih Al-Munajjid
